{
  "schema_version": "1",
  "event_id": "0190a8b0-7c3d-7f2e-8a1b-2c3d4e5f6074",
  "run_id": "0190a8b0-7000-7a00-8000-000000000001",
  "stream_id": "0190a8b0-7000-7a00-8000-000000000002",
  "sequence": 40,
  "type": "capture.gap",
  "occurred_at": "2026-01-01T12:00:05.000Z",
  "trace_id": "4bf92f3577b34da6a3ce929d0e0e4736",
  "span_id": "20f067aa0ba902b9",
  "parent_event_ids": [],
  "invocation_id": "0190a8b0-7000-7a00-8000-000000000007",
  "payload": {
    "after_sequence": 38,
    "expected_count": 1,
    "reason": "buffer_overflow",
    "detail": "SDK buffer exceeded 2000 events; exporter backlogged",
    "redactions": [],
    "replay_safe": false
  }
}
