{
  "schema_version": "1",
  "event_id": "0190a8b0-7c3d-7f2e-8a1b-2c3d4e5f6071",
  "run_id": "0190a8b0-7000-7a00-8000-000000000001",
  "stream_id": "0190a8b0-7000-7a00-8000-000000000002",
  "sequence": 0,
  "type": "run.started",
  "occurred_at": "2026-01-01T12:00:00.000Z",
  "trace_id": "4bf92f3577b34da6a3ce929d0e0e4736",
  "span_id": "00f067aa0ba902b7",
  "parent_event_ids": [],
  "invocation_id": "0190a8b0-7000-7a00-8000-000000000003",
  "payload": {
    "agent_name": "inventory-agent",
    "adapter": "google-adk",
    "adapter_version": "1.2.3",
    "input": { "query": "check stock" },
    "redactions": [],
    "replay_safe": true
  }
}
