{
  "schema_version": "1",
  "event_id": "0190a8b0-7c3d-7f2e-8a1b-2c3d4e5f6075",
  "run_id": "0190a8b0-7000-7a00-8000-00000000000a",
  "stream_id": "0190a8b0-7000-7a00-8000-000000000002",
  "sequence": 7,
  "type": "fault.applied",
  "occurred_at": "2026-01-01T12:00:02.000Z",
  "trace_id": "4bf92f3577b34da6a3ce929d0e0e4736",
  "span_id": "30f067aa0ba902c0",
  "parent_event_ids": [],
  "invocation_id": "0190a8b0-7000-7a00-8000-000000000008",
  "payload": {
    "fault_id": "fault-1",
    "fault_type": "tool.timeout",
    "target_invocation_id": "0190a8b0-7000-7a00-8000-000000000004",
    "parameters": { "delay_ms": 5000 },
    "simulated_latency_ms": 5000,
    "redactions": [],
    "replay_safe": true
  }
}
